Category,Formula,Example,Best For,Trigger Type
E-Commerce Product Pages,The [Product] That [Benefit] Without [Pain Point],The Mattress That Fixes Back Pain Without Breaking The Bank,Premium product positioning,Problem/Solution + Specificity
E-Commerce Product Pages,[Number] [Target Audience] Trust [Product] To [Benefit],"5,000 Athletes Trust This Protein To Build Lean Muscle",Social proof products,Social Proof + Authority
E-Commerce Product Pages,Finally: [Product] That Doesn't [Common Problem],Finally: Headphones That Don't Die After 6 Months,Innovative products,Contrast + Relief
E-Commerce Product Pages,Get [Benefit] In [Timeframe] Or Your Money Back,Get Whiter Teeth In 7 Days Or Your Money Back,Results-focused products,Urgency + Guarantee
E-Commerce Product Pages,Why [Target Audience] Are Switching To [Product],Why Dermatologists Are Switching To This Face Serum,Authority-based products,Curiosity + Social Proof
E-Commerce Product Pages,The [Price Point] Solution To [Expensive Problem],The $39 Solution To Your $3000 Back Pain,Budget-friendly alternatives,Value + Problem-Solution
E-Commerce Product Pages,[Product]: Built For [Specific Use Case] Not [Generic Use],Running Shoes: Built For Marathons Not Morning Jogs,Specialized products,Specificity + Positioning
E-Commerce Product Pages,Stop [Pain Point]. Start [Desired Outcome],Stop Tossing And Turning. Start Sleeping Through The Night,Sleep/wellness products,Command + Transformation
E-Commerce Product Pages,What [Number] Years Of [Research/Development] Looks Like,What 12 Years Of Ergonomic Research Looks Like,Premium/engineered products,Authority + Credibility
E-Commerce Product Pages,"[Product] So [Quality] You'll [Extreme Outcome]","Salsa So Good You'll Eat It With A Spoon",Food and lifestyle products,Hyperbole + Sensory Appeal
E-Commerce Product Pages,The Only [Product] You'll Ever Need For [Job/Task],The Only Knife You'll Ever Need For Meal Prep,Lifetime value products,Simplicity + Promise
E-Commerce Product Pages,How [Product] Delivers [Benefit] Without [Compromise],How This Jacket Delivers Warmth Without The Bulk,Technical products,Problem-Solution + Innovation
E-Commerce Product Pages,"[Benefit] Meets [Benefit]: Introducing [Product]","Comfort Meets Performance: Introducing The CloudRunner",Launch products,Dual benefit positioning
E-Commerce Product Pages,"Before You Buy Another [Generic Product], Read This","Before You Buy Another Smartwatch, Read This",Comparison shopping,Curiosity + Authority
E-Commerce Product Pages,The Secret Behind [Target Audience]'s [Desired Result],The Secret Behind Pro Chefs' Perfect Sear Every Time,Aspirational products,Curiosity + Authority
E-Commerce Product Pages,[Product] That [Unusual Feature/Benefit] And [Bonus],Sunglasses That Float On Water And Block 100% UV,Unique feature products,Stacking Benefits
E-Commerce Product Pages,Your [Pain Point] Isn't Your Fault. Here's Why,Your Dry Skin Isn't Your Fault. Here's Why,Educational positioning,Empathy + Curiosity
E-Commerce Product Pages,Handcrafted [Product] That [Quality Promise],Handcrafted Leather Wallets That Last A Lifetime,Artisan/premium products,Quality + Heritage
E-Commerce Product Pages,[Target Audience]-Approved: [Product] With [Credentials],[Dermatologist-Approved: Face Cream With Clinical Results],Medical/professional products,Authority + Trust
E-Commerce Product Pages,"Everyone's Buying [Product]. Here's Why You Should Too","Everyone's Buying Bamboo Sheets. Here's Why You Should Too",Trending products,FOMO + Bandwagon
SaaS Landing Pages,The [Tool Type] That Saves You [Timeframe] Per [Period],The CRM That Saves You 10 Hours Per Week,Productivity tools,Time Value + Specificity
SaaS Landing Pages,[Achieve Goal] Without [Pain Point/Cost],Scale Your Agency Without Hiring More Designers,Growth-focused SaaS,Problem-Solution
SaaS Landing Pages,How [Company Type] Use [Product] To [Measurable Result],How Startups Use This Tool To Close 40% More Deals,B2B SaaS platforms,Social Proof + Results
SaaS Landing Pages,[Product]: [Complex Task] Made Simple,[Product]: Project Management Made Simple,Complexity-reducing tools,Simplicity Promise
SaaS Landing Pages,Stop Wasting [Resource] On [Task/Problem],Stop Wasting Money On Freelance Designers,Cost-saving SaaS,Pain Point + Urgency
SaaS Landing Pages,All Your [Tasks] In One [Solution Type],All Your Marketing Tools In One Dashboard,Integration platforms,Consolidation + Simplicity
SaaS Landing Pages,From [Current State] To [Desired State] In [Timeframe],From Chaos To Organized In 24 Hours,Transformation tools,Before/After + Speed
SaaS Landing Pages,[Number] Companies Already [Result]. Join Them,"2,500 Companies Already Hit Their Revenue Goals. Join Them",Fast-growing SaaS,Social Proof + FOMO
SaaS Landing Pages,The [Niche] Tool Built By [Niche] For [Niche],The Agency Tool Built By Agency Owners For Agency Owners,Vertical SaaS,Authority + Specificity
SaaS Landing Pages,Why [Alternative Solution] Fails And [Product] Succeeds,Why Spreadsheets Fail And This Inventory System Succeeds,Comparison positioning,Contrast + Authority
SaaS Landing Pages,[Do Task] [Number]x Faster With [Product Feature],Create Content 5x Faster With AI-Powered Templates,Speed-focused SaaS,Quantified Benefit
SaaS Landing Pages,The Smart Way To [Achieve Goal] For [Target Audience],The Smart Way To Manage Client Projects For Consultants,Efficiency tools,Positioning + Specificity
SaaS Landing Pages,Never [Pain Point] Again With [Product],Never Miss A Lead Again With Smart Automation,Automation SaaS,Problem Elimination
SaaS Landing Pages,What If You Could [Desired Outcome] While [Doing Something Else],What If You Could Generate Leads While You Sleep,Automation/passive tools,Possibility + Benefit
SaaS Landing Pages,[Product]: Like [Familiar Tool] But [Key Differentiator],[Product]: Like Slack But Built For Customer Support,Comparison SaaS,Familiar + Contrast
SaaS Landing Pages,Free Yourself From [Pain Point] Forever,Free Yourself From Manual Data Entry Forever,Liberation-focused copy,Emotional + Freedom
SaaS Landing Pages,The [Price Point] Tool That Competes With [Expensive Alternative],The $29/Mo Tool That Competes With $299/Mo HubSpot,Budget alternatives,Value + Comparison
SaaS Landing Pages,Built For Teams Who [Specific Challenge/Goal],Built For Teams Who Need To Ship Features Fast,Niche targeting,Specificity + Identity
SaaS Landing Pages,[Intimidating Task] Anyone Can Master,Analytics Anyone Can Master,Beginner-friendly SaaS,Accessibility + Empowerment
SaaS Landing Pages,See Why [Target Audience] Love [Product] More Than [Competitor],See Why Marketers Love This More Than Google Analytics,Competitive positioning,Comparison + Social Proof
Lead Magnets,The [Number]-[Type] Guide To [Achieving Goal],The 7-Step Guide To Doubling Your Email List,Educational guides,Structured + Specific
Lead Magnets,[Number] [Topic] Secrets [Authority Figure] Won't Tell You,12 SEO Secrets Agencies Won't Tell You,Industry secrets,Curiosity + Authority
Lead Magnets,Free: [Tool Type] That [Specific Benefit],Free: Checklist That Eliminates Project Delays,Tools and templates,Value + Utility
Lead Magnets,How To [Achieve Goal] Even If [Common Objection],How To Build Muscle Even If You Hate The Gym,Objection-handling content,Accessibility + Problem-Solution
Lead Magnets,The Ultimate [Topic] Cheat Sheet For [Target Audience],The Ultimate Sales Copy Cheat Sheet For Founders,Quick reference resources,Utility + Targeting
Lead Magnets,Steal My [Number]-[Unit] [Result/System],Steal My 90-Day Content Calendar,Done-for-you resources,Theft/Swipe + Urgency
Lead Magnets,[Achieve Goal] In [Timeframe]: The Complete Blueprint,Scale To $10K/Mo In 90 Days: The Complete Blueprint,Roadmap content,Timeframe + Completeness
Lead Magnets,What [Number] [Successful Examples] Know About [Topic],"What 500 Six-Figure Coaches Know About Client Acquisition",Insider knowledge,Authority + Numbers
Lead Magnets,The Only [Topic] Resource You'll Ever Need,The Only Copywriting Template Library You'll Ever Need,Comprehensive resources,Completeness + Promise
Lead Magnets,Free Training: [Specific Skill] In Under [Timeframe],Free Training: Master Facebook Ads In Under 60 Minutes,Quick-win training,Speed + Learning
Lead Magnets,[Number] Ways To [Achieve Goal] Starting Today,[47 Ways To Get More Clients Starting Today],Actionable lists,Quantity + Immediacy
Lead Magnets,The [Topic] Mistakes Costing You [Negative Outcome],The Landing Page Mistakes Costing You 50% Of Your Leads,Mistake-focused content,Fear + Loss Aversion
Lead Magnets,Download: The [Result] Template Used By [Successful Group],Download: The Sales Script Used By Top 1% Closers,Proven templates,Social Proof + Results
Lead Magnets,[Topic] Masterclass: From [Current State] To [Desired State],[Topic] Masterclass: From Zero To 10K Followers,Transformation training,Before/After + Education
Lead Magnets,Get The [Tool/Resource] That Generated [Impressive Result],Get The Email Sequence That Generated $250K In Sales,Results-based resources,Proof + Curiosity
Lead Magnets,The [Number]-Minute [Topic] Crash Course That [Benefit],The 15-Minute Copywriting Crash Course That 10x'd My Business,Quick learning,Timeframe + Results
Lead Magnets,Free [Tool]: Calculate Your [Valuable Metric],Free Calculator: Calculate Your Customer Lifetime Value,Interactive tools,Utility + Specificity
Lead Magnets,Discover The [System/Framework] Behind [Impressive Achievement],Discover The Framework Behind Our 400% Revenue Growth,Behind-the-scenes content,Curiosity + Proof
Lead Magnets,[Target Audience]'s Guide To [Complex Topic] (Simple Version),[Beginner's Guide To Facebook Ads (Simple Version)],Simplified education,Accessibility + Relief
Lead Magnets,Access Granted: [Exclusive Resource] For [Target Audience],Access Granted: Private Community For E-Commerce Founders,Exclusive content,Exclusivity + Belonging
Email Campaigns,You Left Something Behind...,You Left Something Behind...,Cart abandonment,Curiosity + Urgency
Email Campaigns,[Name] - Quick Question About [Topic],[Sarah] - Quick Question About Your Marketing,Personal outreach,Personalization + Curiosity
Email Campaigns,This Expires Tonight: [Offer],[This Expires Tonight: 40% Off Everything],Flash sales,Urgency + Clarity
Email Campaigns,I Noticed You [Specific Action]...,I Noticed You Downloaded Our Guide...,Behavioral triggers,Personalization + Follow-up
Email Campaigns,[Number] Hours Left: [Benefit/Offer],[24 Hours Left: Free Shipping On Everything],Countdown urgency,Scarcity + Clarity
Email Campaigns,Ready To [Achieve Goal]? Here's How,[Ready To 2x Your Revenue? Here's How],Re-engagement,Question + Solution
Email Campaigns,We Made This For You: [Personalized Offer],We Made This For You: Your Custom Marketing Plan,Personalized content,Exclusivity + Gift
Email Campaigns,Your [Item/Resource] Is Waiting,[Your Free Template Library Is Waiting],Delivery emails,Anticipation + Fulfillment
Email Campaigns,Last Call: [Opportunity] Ends [Timeframe],Last Call: Early Bird Pricing Ends At Midnight,Final urgency,Scarcity + Deadline
Email Campaigns,[Controversial Statement] - Here's Why,[Email Marketing Is Dead - Here's Why],Controversial hooks,Shock + Curiosity
Email Campaigns,Thanks For [Action] - Here's What's Next,Thanks For Joining - Here's What's Next,Welcome sequences,Gratitude + Direction
Email Campaigns,You're Invited: [Exclusive Opportunity],You're Invited: Private Mastermind For Top Performers,VIP opportunities,Exclusivity + Status
Email Campaigns,[Question That Reveals Pain Point],[Struggling To Get Clients? Here's Why],Problem-focused,Empathy + Curiosity
Email Campaigns,New: [Product/Feature] Just Dropped,New: Instagram Scheduler Just Dropped,Launch announcements,Novelty + Excitement
Email Campaigns,People Are Asking About [Topic]. Here's The Answer,People Are Asking About Our Refund Policy. Here's The Answer,FAQ content,Social Proof + Transparency
Email Campaigns,Special Gift Inside: [Surprise Bonus],Special Gift Inside: 3 Months Free Premium,Surprise bonuses,Gift + Curiosity
Email Campaigns,Can I Be Honest With You About [Topic],Can I Be Honest With You About Growing Your Business,Vulnerable positioning,Trust + Intimacy
Email Campaigns,Your [Metric/Status] Looks Great - But Here's How To [Improve],Your Open Rates Look Great - But Here's How To Double Them,Optimization emails,Compliment + Opportunity
Email Campaigns,Breaking: [News/Update] About [Topic],Breaking: Major Algorithm Update About SEO,News-based emails,Urgency + Importance
Email Campaigns,You're Missing Out On [Specific Benefit],You're Missing Out On 10x Faster Delivery,FOMO campaigns,Loss Aversion + Benefit
Social Media Ads,Scroll-Stopper: [Unusual Statement/Fact],Scroll-Stopper: We Pay You To Use Our Product,Attention-grabbing,Pattern Interrupt
Social Media Ads,[Target Audience]: Stop [Common Mistake],[Gym Owners: Stop Posting Workout Videos],Targeted callouts,Direct Address + Command
Social Media Ads,This [Product] Is [Unusual Claim]. Here's Proof,This Course Is Free. Here's Proof,Disbelief hooks,Claim + Evidence
Social Media Ads,POV: You [Relatable Scenario],POV: You Finally Found Jeans That Actually Fit,Relatability hooks,Identity + Relief
Social Media Ads,If You [Condition] This Is For You,If You Hate Cooking This Is For You,Conditional targeting,Self-Selection
Social Media Ads,Nobody Talks About [Hidden Truth],Nobody Talks About The Real Cost Of DIY Marketing,Contrarian positioning,Curiosity + Truth
Social Media Ads,I Spent [Amount/Time] On [Topic] So You Don't Have To,I Spent $50K On Facebook Ads So You Don't Have To,Sacrifice positioning,Value + Authority
Social Media Ads,The [Product/Method] [Unexpected Group] Are Using,The Meditation App Navy SEALs Are Using,Unlikely social proof,Authority + Curiosity
Social Media Ads,"Watch: [Impressive Demonstration]","Watch: This Stain Vanishes In 3 Seconds",Visual proof,Demonstration + Curiosity
Social Media Ads,Why Your [Tool/Method] Isn't [Working/Enough],Why Your Current CRM Isn't Enough For Growth,Problem awareness,Pain Point + Curiosity
Social Media Ads,[Do Something] Like [Aspirational Figure/Group],[Build Muscle Like Fitness Models Do],Aspiration positioning,Comparison + Desire
Social Media Ads,This [Time Period] Changed Everything,This One Call Changed Everything,Transformation story,Story + Curiosity
Social Media Ads,"Yes, [Address Objection]. And Here's Why","Yes, It's Expensive. And Here's Why",Objection pre-handle,Transparency + Confidence
Social Media Ads,What [Number] [Unit] Of [Activity] Taught Me,"What 1,000 Sales Calls Taught Me About Closing",Experience-based authority,Authority + Lessons
Social Media Ads,Tag Someone Who [Relatable Behavior],Tag Someone Who Checks Their Phone Every 5 Minutes,Viral engagement,Relatability + Sharing
Social Media Ads,The Difference Between [Unsuccessful] And [Successful],The Difference Between $5K Months And $50K Months,Comparison positioning,Contrast + Aspiration
Social Media Ads,Real Results: [Customer Outcome] In [Timeframe],Real Results: Lost 30 Pounds In 90 Days,Social proof ads,Results + Credibility
Social Media Ads,[Emotional Hook]: [Specific Scenario],Exhausted: Running A Business From Your Phone,Emotion-first positioning,Emotion + Relatability
Social Media Ads,"Stop [Common Advice]. Try [Better Alternative] Instead","Stop Running Ads. Try SEO Instead",Contrarian advice,Controversy + Alternative
Social Media Ads,The [Price] [Product] That Outperforms [Expensive Alternative],The $29 Blender That Outperforms $400 Vitamix,Value positioning,Price + Comparison
VSLs/Webinars,Warning: [Common Approach] Could Be [Negative Outcome],Warning: Your Current Email Strategy Could Be Killing Sales,Fear-based hooks,Urgency + Fear
VSLs/Webinars,The [Controversial Method] That [Impressive Result],The Backwards Sales Method That Doubled Our Close Rate,Unique mechanism,Intrigue + Results
VSLs/Webinars,What [Authority Figure] Don't Want You To Know About [Topic],What Fitness Trainers Don't Want You To Know About Fat Loss,Conspiracy angle,Curiosity + Authority
VSLs/Webinars,How A [Regular Person] [Achieved Extraordinary Result],How A School Teacher Built A $2M Business From Her Kitchen,Relatability story,Underdog + Results
VSLs/Webinars,Revealed: The [System/Secret] Behind [Success Story],Revealed: The System Behind Our 8-Figure Launch,Behind-the-scenes,Curiosity + Proof
VSLs/Webinars,"If You [Condition], You Need To See This","If You Make Under $10K/Mo, You Need To See This",Conditional targeting,Relevance + Urgency
VSLs/Webinars,The [Number]-[Unit] Challenge That [Result],The 30-Day Challenge That Transforms Your Business,Challenge-based,Commitment + Results
VSLs/Webinars,Free Training: [Specific Outcome] Without [Common Requirement],Free Training: Build Your List Without Paid Ads,Educational positioning,Value + Unique Method
VSLs/Webinars,I'm Going To Show You How To [Achieve Goal] Starting [Timeframe],I'm Going To Show You How To Get Clients Starting Tomorrow,Direct promise,Clarity + Speed
VSLs/Webinars,This [Short Duration] [Presentation Type] Will Change [Outcome],This 45-Minute Masterclass Will Change Your Entire Sales Process,Transformation promise,Time Investment + Benefit
VSLs/Webinars,The Untold Truth About [Topic] And [Related Topic],The Untold Truth About Funnels And Why Most Fail,Hidden knowledge,Curiosity + Authority
VSLs/Webinars,[Number] [Successful People] Share Their [Specific Strategy],[7 Seven-Figure Founders Share Their Content Strategy],Expert panel positioning,Authority + Social Proof
VSLs/Webinars,Why [Old Method] Is Dead And What To Do Instead,Why Cold Calling Is Dead And What To Do Instead,Replacement positioning,Controversy + Solution
VSLs/Webinars,Live Demo: How To [Specific Task] In [Timeframe],Live Demo: How To Build A Funnel In 60 Minutes,Demonstration value,Proof + Speed
VSLs/Webinars,Case Study: How We [Specific Achievement],Case Study: How We Got 10K Subscribers In 30 Days,Proof-based content,Results + Story
VSLs/Webinars,Join [Number] [People] Learning [Skill/Topic] Live,"Join 5,000 Marketers Learning AI Prompts Live",Community event,Social Proof + FOMO
VSLs/Webinars,The [Topic] Breakthrough That [Unexpected Benefit],The Productivity Breakthrough That Gave Me My Weekends Back,Innovation positioning,Curiosity + Lifestyle
VSLs/Webinars,[Timeframe] From Now You'll Either [Positive] Or [Negative],[One Year From Now You'll Either Be Thriving Or Still Struggling],Fork-in-road positioning,Urgency + Contrast
VSLs/Webinars,What Nobody Tells You Before You [Big Decision],What Nobody Tells You Before You Quit Your Job,Pre-decision education,Authority + Honesty
VSLs/Webinars,Master [Skill] Before [Negative Outcome Happens],Master Sales Before AI Replaces Your Job,Urgency positioning,Fear + Skill Building
Blog Posts/Content,The Complete Guide To [Topic] For [Target Audience],The Complete Guide To LinkedIn For B2B Founders,Comprehensive content,Authority + Targeting
Blog Posts/Content,[Number] [Topic] Examples That [Result],[50 Landing Page Examples That Convert At 40%+],Example-based content,Social Proof + Inspiration
Blog Posts/Content,How To [Achieve Goal]: [Number]-Step Framework,How To Write Sales Copy: 5-Step Framework,Educational content,Structure + Clarity
Blog Posts/Content,Everything I Know About [Topic] After [Time/Experience],Everything I Know About Facebook Ads After Spending $2M,Authority content,Experience + Value
Blog Posts/Content,[Topic] vs [Topic]: Which Is Better For [Use Case],SEO vs Paid Ads: Which Is Better For SaaS Companies,Comparison content,Decision-making Help
Blog Posts/Content,The [Topic] Mistakes That Are [Negative Outcome],The SEO Mistakes That Are Tanking Your Rankings,Mistake-focused content,Problem Awareness
Blog Posts/Content,[Number] Ways To [Achieve Goal] (With Examples),[15 Ways To Grow Your Email List (With Examples)],Listicle + proof,Actionable + Specific
Blog Posts/Content,What Is [Topic]? [Simple/Complete] Explanation,What Is Conversion Rate Optimization? Complete Explanation,Definition content,Educational + SEO
Blog Posts/Content,Why [Common Belief] Is Wrong About [Topic],Why Everyone Is Wrong About Content Marketing,Contrarian content,Curiosity + Authority
Blog Posts/Content,[Topic] In [Current Year]: What's Changed And What Works,[Email Marketing In 2026: What's Changed And What Works],Updated content,Timeliness + Relevance
Blog Posts/Content,How [Successful Person/Company] [Achieved Result],How Airbnb Grew To $1B Without Traditional Marketing,Case study content,Story + Authority
Blog Posts/Content,The Science Behind [Topic]: [What Research Shows],The Science Behind Habit Formation: What Research Shows,Research-based content,Authority + Credibility
Blog Posts/Content,Beginner's Guide: [Topic] Explained Simply,Beginner's Guide: Copywriting Explained Simply,Entry-level content,Accessibility + SEO
Blog Posts/Content,[Number] [Topic] Tools We Actually Use And Recommend,[12 Marketing Tools We Actually Use And Recommend],Review content,Trust + Utility
Blog Posts/Content,How To [Do Task] Without [Common Requirement/Tool],How To Build A Brand Without A Big Budget,Alternative method,Accessibility + Innovation
Blog Posts/Content,The Only [Topic] Checklist You Need,The Only Product Launch Checklist You Need,Resource content,Completeness + Utility
Blog Posts/Content,[Topic] Statistics That [Surprising Insight],[Remote Work Statistics That Will Change How You Hire],Data-driven content,Authority + Surprise
Blog Posts/Content,My [Timeframe] [Topic] Journey: [Result],My 90-Day Content Journey: From 0 To 100K Views,Personal story,Relatability + Results
Blog Posts/Content,[Number] Lessons From [Experience],7 Lessons From Building A 7-Figure Online Business,Wisdom content,Authority + Value
Blog Posts/Content,Is [Topic] Worth It? Honest [Analysis/Review],Is ClickFunnels Worth It? Honest 2026 Review,Review content,Transparency + Decision Help
Cold Outreach,[Mutual Connection] Suggested I Reach Out,[Sarah Jones] Suggested I Reach Out,Personal introduction,Social Proof + Warm
Cold Outreach,Quick Question About [Specific Company Detail],Quick Question About Your Recent Product Launch,Research-based,Personalization + Relevance
Cold Outreach,Saw Your Post About [Topic] - Thought You'd Like This,Saw Your Post About Scaling - Thought You'd Like This,Social listening,Relevance + Value
Cold Outreach,[Specific Observation] Caught My Eye,Your Landing Page Speed Caught My Eye,Attention to detail,Personalization + Hook
Cold Outreach,Fellow [Shared Identity] Here,Fellow Agency Owner Here,Common ground,Identity + Rapport
Cold Outreach,Love What You're Doing With [Specific Project],Love What You're Doing With Your Newsletter,Genuine compliment,Flattery + Specificity
Cold Outreach,This Might Be A Long Shot But...,This Might Be A Long Shot But...,Humble approach,Curiosity + Low Pressure
Cold Outreach,[Company Name]: [Specific Opportunity] Worth Exploring,[Acme Corp]: Partnership Worth Exploring,Direct value,Clarity + Relevance
Cold Outreach,Noticed [Problem] - Built Something That Helps,Noticed Your Site Loads Slow - Built Something That Helps,Problem-solution,Value + Relevance
Cold Outreach,[Name] - We Should Talk About [Mutual Interest],[Mike] - We Should Talk About The AI Space,Direct invitation,Authority + Shared Interest
Cold Outreach,Congrats On [Recent Achievement] - Quick Idea,Congrats On Your Series A - Quick Idea,Timely recognition,Relevance + Brevity
Cold Outreach,Different Approach To [Pain Point] For [Company Type],Different Approach To Lead Gen For B2B SaaS,Solution-focused,Innovation + Targeting
Cold Outreach,Your [Competitor] Uses This. Thought You Should See It,Your Competitor Uses This Email Tool. Thought You Should See It,Competitive angle,FOMO + Value
Cold Outreach,[Intriguing Question About Their Business],[Are You Happy With Your Customer Onboarding?],Question hook,Curiosity + Relevance
Cold Outreach,Helped [Similar Company] [Achieve Result] - Can We Chat,Helped 3 SaaS Companies 2x MRR - Can We Chat,Social proof pitch,Results + CTA
Cold Outreach,Not Your Typical [Sales Pitch Type],Not Your Typical Cold Email,Pattern interrupt,Intrigue + Different
Cold Outreach,[Name] - [Mutual Benefit] Opportunity,[Sarah] - Win-Win Partnership Opportunity,Value exchange,Clarity + Fairness
Cold Outreach,Respect What You're Building - Have An Idea,Respect What You're Building - Have An Idea,Admiration + value,Flattery + Contribution
Cold Outreach,Your [Specific Content] Inspired This Tool,Your LinkedIn Post About Hiring Inspired This Tool,Content callback,Personalization + Relevance
Cold Outreach,[Time-Sensitive Opportunity] Before [Deadline],[Free Audit Offer] Before We're Fully Booked,Urgency hook,Scarcity + Value